,sent_a,sent_b,label
3137,Matt's cousins couldn't consider it to be natural that Cynthia wasn't yelling.,Matt's cousins urge it to be natural that Cynthia wasn't yelling.,0.0
3138,Kathleen discovered it to be worth mentioning that most waiters wave.,Kathleen begged it to be worth mentioning that most waiters wave.,0.0
3139,The actors badger it to be unsuprising that Rose had pressed Alan to escape.,The actors had judged it to be unsuprising that Rose had pressed Alan to escape.,1.0
3140,Thomas's ex-boyfriends prefer it to be noteworthy that Paul isn't figuring out who interact.,Thomas's ex-boyfriends could pressure it to be noteworthy that Paul isn't figuring out who interact.,0.0
3141,Stacy found it to be unusual that Beth boasts.,Stacy wouldn't prod it to be unusual that Beth boasts.,0.0
3142,Renee hadn't implored it to be important that Joel advises Diane to suffer.,Renee needed it to be important that Joel advises Diane to suffer.,1.0
3143,The waitresses won't believe it to be worth saying that Eric escapes.,The waitresses press it to be worth saying that Eric escapes.,0.0
3144,Those people entreat it to be not so clear that David hadn't murmured.,Those people haven't judged it to be not so clear that David hadn't murmured.,1.0
3145,Marcus motivated it to be cool that Jane hadn't investigated all women.,Marcus prefers it to be cool that Jane hadn't investigated all women.,1.0
3146,Galileo hadn't compelled it to be lucky that that adult wasn't healing teenagers.,Galileo needs it to be lucky that that adult wasn't healing teenagers.,1.0
3147,Those boys' lawyers ordered it to be unusual that those dancers weren't compelling these patients to wave.,Those boys' lawyers judge it to be unusual that those dancers weren't compelling these patients to wave.,1.0
3148,Scott's ex-boyfriends haven't found it to be good that those libraries like Karen.,Scott's ex-boyfriends require it to be good that those libraries like Karen.,0.0
3149,Drivers' grandfathers wouldn't want it to be natural that Daniel should figure out who proposes to descend the mountains.,Drivers' grandfathers prompt it to be natural that Daniel should figure out who proposes to descend the mountains.,0.0
3150,Some patients have pressed it to be not so good that Claire wouldn't scream.,Some patients are wanting it to be not so good that Claire wouldn't scream.,1.0
3151,Kathleen required it to be amusing that Diana fell asleep.,Kathleen discovered it to be amusing that Diana fell asleep.,1.0
3152,Suzanne believes it to be too bad that the girls see Cheryl.,Suzanne wasn't persuading it to be too bad that the girls see Cheryl.,0.0
3153,Those analyses ask it to be too bad that some senators could hire the Clintons.,Those analyses judge it to be too bad that some senators could hire the Clintons.,1.0
3154,Heather anticipated it to be acceptable that Dana should declare Gerald to resemble the picture.,Heather urged it to be acceptable that Dana should declare Gerald to resemble the picture.,0.0
3155,Mary's colleagues discover it to be normal that Walter appeared to embrace.,Mary's colleagues did require it to be normal that Walter appeared to embrace.,0.0
3156,Edward believes it to be natural that Sandra does work with a doctor.,Edward had swayed it to be natural that Sandra does work with a doctor.,0.0
3157,Travis's brother expected it to be worth saying that Gina is reading.,Travis's brother is swaying it to be worth saying that Gina is reading.,0.0
3158,These organizations would anticipate it to be clear that Bradley presses Tara to conceal Lori.,These organizations shouldn't badger it to be clear that Bradley presses Tara to conceal Lori.,0.0
3159,Richard's guests found it to be odd that Becca isn't saluting.,Richard's guests beg it to be odd that Becca isn't saluting.,0.0
3160,Tanya's bosses anticipate it to be not so nice that the Clintons bike to most closets.,Tanya's bosses force it to be not so nice that the Clintons bike to most closets.,0.0
3161,Jessica tempts it to be acceptable that Todd copes.,Jessica was judging it to be acceptable that Todd copes.,1.0
3162,Bethany hasn't swayed it to be not so important that a driver will continue to weep.,Bethany was considering it to be not so important that a driver will continue to weep.,1.0
3163,Angela's sisters ordered it to be uninteresting that this spotlight faded.,Angela's sisters declare it to be uninteresting that this spotlight faded.,1.0
3164,Keith believes it to be lucky that these guests escape from David.,Keith compelled it to be lucky that these guests escape from David.,0.0
3165,Carla had considered it to be funny that Richard had failed to wave.,Carla can induce it to be funny that Richard had failed to wave.,0.0
3166,A lady expects it to be unlucky that many pedestrians want some legislature to meet.,A lady tempted it to be unlucky that many pedestrians want some legislature to meet.,0.0
3167,Russell begs it to be interesting that many guests leave that bank.,Russell expects it to be interesting that many guests leave that bank.,1.0
3168,Homer advised it to be not so obvious that those glaciers aren't evaporating.,Homer discovers it to be not so obvious that those glaciers aren't evaporating.,1.0
3169,The girl forced it to be strange that a child prevented Teresa from talking to Adam.,The girl needed it to be strange that a child prevented Teresa from talking to Adam.,1.0
3170,Tammy's contractor is finding it to be weird that most committees should cooperate.,Tammy's contractor persuades it to be weird that most committees should cooperate.,0.0
3171,Regina forced it to be obvious that Maria thought about Anna.,Regina wanted it to be obvious that Maria thought about Anna.,1.0
3172,Sabrina wasn't anticipating it to be unsuprising that Rhonda wins.,Sabrina badgered it to be unsuprising that Rhonda wins.,0.0
3173,Most brothers of Victoria discover it to be unsuprising that some lamps can dim.,Most brothers of Victoria badgered it to be unsuprising that some lamps can dim.,0.0
3174,The cousin of Julie wants it to be too bad that Anna cleans these glasses.,The cousin of Julie had compelled it to be too bad that Anna cleans these glasses.,0.0
3175,Valerie is imploring it to be not so good that this steak bakes.,Valerie might want it to be not so good that this steak bakes.,1.0
3176,Judy's daughters begged it to be not so interesting that Tamara cheers.,Judy's daughters discover it to be not so interesting that Tamara cheers.,1.0
3177,Brian's lawyer should expect it to be interesting that Marie performs.,Brian's lawyer obligates it to be interesting that Marie performs.,0.0
3178,All associations press it to be not so weird that Teresa shouldn't weep.,All associations would find it to be not so weird that Teresa shouldn't weep.,1.0
3179,Todd considers it to be interesting that Ronald has described Joseph.,Todd is tempting it to be interesting that Ronald has described Joseph.,0.0
3180,Helen's mentors haven't obliged it to be weird that these actresses can clash.,Helen's mentors are considering it to be weird that these actresses can clash.,1.0
3181,James preferred it to be normal that Monet did implore some doctor to see a shirt.,James should compel it to be normal that Monet did implore some doctor to see a shirt.,0.0
3182,Catherine anticipates it to be natural that a glove folds.,Catherine obligated it to be natural that a glove folds.,0.0
3183,Jason hasn't believed it to be unpleasant that adults alarmed John.,Jason hadn't spurred it to be unpleasant that adults alarmed John.,0.0
3184,Aaron's dermatologist believes it to be okay that Carrie disgusted a lot of girls.,Aaron's dermatologist enticed it to be okay that Carrie disgusted a lot of girls.,0.0
3185,Amanda doesn't implore it to be worth noting that these actresses hope to exist.,Amanda predicted it to be worth noting that these actresses hope to exist.,1.0
3186,That grandfather of James hasn't expected it to be expected that Joseph talks to Tanya.,That grandfather of James was pressing it to be expected that Joseph talks to Tanya.,0.0
3187,Brett will command it to be pleasant that Becca sounded like Suzanne.,Brett is considering it to be pleasant that Becca sounded like Suzanne.,1.0
3188,Christine tempted it to be worth mentioning that those customers neglect to drive to every hill.,Christine hasn't discovered it to be worth mentioning that those customers neglect to drive to every hill.,1.0
3189,Sherry wasn't wanting it to be surprising that Monica prevents Stacy from hiring Beth.,Sherry can't tempt it to be surprising that Monica prevents Stacy from hiring Beth.,0.0
3190,Joseph's sisters had ascertained it to be not so nice that Eva hadn't known who haven't met.,Joseph's sisters command it to be not so nice that Eva hadn't known who haven't met.,0.0
3191,Some teenagers predict it to be amusing that Diane scans a story.,Some teenagers didn't prod it to be amusing that Diane scans a story.,0.0
3192,Timothy's classmate obliges it to be unexpected that Gregory hasn't wanted Dana to descend those steps.,Timothy's classmate found it to be unexpected that Gregory hasn't wanted Dana to descend those steps.,1.0
3193,All offspring had discovered it to be unfortunate that every cart does slow.,All offspring entice it to be unfortunate that every cart does slow.,0.0
3194,These guests persuaded it to be unexpected that Andrew wasn't cleaning some cafe.,These guests believe it to be unexpected that Andrew wasn't cleaning some cafe.,1.0
3195,Carl's fathers weren't needing it to be obvious that a lot of cars had stopped.,Carl's fathers induce it to be obvious that a lot of cars had stopped.,0.0
3196,Grace was motivating it to be too bad that Julia wouldn't bring the dress.,Grace expects it to be too bad that Julia wouldn't bring the dress.,1.0
3197,Stephanie hasn't expected it to be funny that those women are debating.,Stephanie wasn't enticing it to be funny that those women are debating.,0.0
3198,Many teachers preferred it to be not so pleasant that a lot of companies reunite.,Many teachers convinced it to be not so pleasant that a lot of companies reunite.,0.0
3199,Kenneth is expecting it to be not so weird that Noah wasn't returning to this school.,Kenneth obliged it to be not so weird that Noah wasn't returning to this school.,0.0
3200,The Borgias wore a lot of scarves.,The Borgias worn a lot of scarves.,0.0
3201,Teresa hid every senator.,Teresa hidden every senator.,0.0
3202,The mushroom gone bad.,The mushroom went bad.,1.0
3203,Cheryl come here.,Cheryl came here.,1.0
3204,Christopher hid a spotlight.,Christopher hidden a spotlight.,0.0
3205,Edward hidden the cats.,Edward hid the cats.,1.0
3206,Erin gone to some schools.,Erin went to some schools.,1.0
3207,Joel come here.,Joel came here.,1.0
3208,Paula broke some plates.,Paula broken some plates.,0.0
3209,Raymond woke up.,Raymond woken up.,0.0
3210,Randolf driven to a mall.,Randolf drove to a mall.,1.0
3211,Laura broke this cart.,Laura broken this cart.,0.0
3212,Victoria wore that hat.,Victoria worn that hat.,0.0
3213,Carrie taken most bikes.,Carrie took most bikes.,1.0
3214,Nancy sang.,Nancy sung.,0.0
3215,The guy sang.,The guy sung.,0.0
3216,The women broke a lot of convertibles.,The women broken a lot of convertibles.,0.0
3217,Lucille gone to some cafe.,Lucille went to some cafe.,1.0
3218,Sandra knew Becca.,Sandra known Becca.,0.0
3219,Susan knew Florence.,Susan known Florence.,0.0
3220,Many girls took that banana.,Many girls taken that banana.,0.0
3221,Melissa eaten.,Melissa ate.,1.0
3222,Andrew wrote.,Andrew written.,0.0
3223,Kendra knew Florence.,Kendra known Florence.,0.0
3224,Guests woke up.,Guests woken up.,0.0
3225,Suzanne sung.,Suzanne sang.,1.0
3226,Catherine knew Amanda.,Catherine known Amanda.,0.0
3227,Frank hid away.,Frank hidden away.,0.0
3228,Libraries forgot Douglas.,Libraries forgotten Douglas.,0.0
3229,Every waiter hid Julia.,Every waiter hidden Julia.,0.0
3230,This person spoke up.,This person spoken up.,0.0
3231,Caroline hidden.,Caroline hid.,1.0
3232,That coat shrank.,That coat shrunk.,0.0
3233,James eaten.,James ate.,1.0
3234,Michael driven to all hospitals.,Michael drove to all hospitals.,1.0
3235,Todd took every car.,Todd taken every car.,0.0
3236,Most ladies hid away.,Most ladies hidden away.,0.0
3237,Aaron broken the unicycle.,Aaron broke the unicycle.,1.0
3238,Stacey taken chicken.,Stacey took chicken.,1.0
3239,Charles forgot Sarah.,Charles forgotten Sarah.,0.0
3240,Every teenager gone to the hospitals.,Every teenager went to the hospitals.,1.0
3241,These guests got fired.,These guests gotten fired.,0.0
3242,Elizabeth broken the carriages.,Elizabeth broke the carriages.,1.0
3243,Claire woken up.,Claire woke up.,1.0
3244,Alice woke up.,Alice woken up.,0.0
3245,Victoria wrote.,Victoria written.,0.0
3246,Allison got a job.,Allison gotten a job.,0.0
3247,This dancer broke many glasses.,This dancer broken many glasses.,0.0
3248,Banks knew Elaine.,Banks known Elaine.,0.0
3249,The Lutherans hid.,The Lutherans hidden.,0.0
3250,Kimberley driven to this high school.,Kimberley drove to this high school.,1.0
3251,Some boy spoke up.,Some boy spoken up.,0.0
3252,Tiffany sang.,Tiffany sung.,0.0
3253,Mitchell broke a lot of forks.,Mitchell broken a lot of forks.,0.0
3254,Jessica driven to all museums.,Jessica drove to all museums.,1.0
3255,Valerie hid away.,Valerie hidden away.,0.0
3256,Jesus eaten.,Jesus ate.,1.0
3257,Some customer hid.,Some customer hidden.,0.0
3258,All actresses hid away.,All actresses hidden away.,0.0
3259,Marcus worn this sock.,Marcus wore this sock.,1.0
3260,Bradley known Stacy.,Bradley knew Stacy.,1.0
3261,Helen taken a lot of lamps.,Helen took a lot of lamps.,1.0
3262,These drivers came here.,These drivers come here.,0.0
3263,Veronica driven to the hospitals.,Veronica drove to the hospitals.,1.0
3264,Lori hidden away.,Lori hid away.,1.0
3265,A lot of teenagers spoken up.,A lot of teenagers spoke up.,1.0
3266,Danielle knew George.,Danielle known George.,0.0
3267,Suzanne broken those trucks.,Suzanne broke those trucks.,1.0
3268,A lot of actresses taken some river.,A lot of actresses took some river.,1.0
3269,Marla drank.,Marla drunk.,0.0
3270,Edward broke some chair.,Edward broken some chair.,0.0
3271,Sharon spoken up.,Sharon spoke up.,1.0
3272,Many boys woken up.,Many boys woke up.,1.0
3273,Sally gone fishing.,Sally went fishing.,1.0
3274,Tammy woke up.,Tammy woken up.,0.0
3275,Monica eaten.,Monica ate.,1.0
3276,Adam ate.,Adam eaten.,0.0
3277,Patrick broke a lot of wheelbarrows.,Patrick broken a lot of wheelbarrows.,0.0
3278,Lisa ate.,Lisa eaten.,0.0
3279,Those students driven to Spain.,Those students drove to Spain.,1.0
3280,Carla went to schools.,Carla gone to schools.,0.0
3281,Some people broken that chair.,Some people broke that chair.,1.0
3282,A lot of dancers broken the vases.,A lot of dancers broke the vases.,1.0
3283,Some children come here.,Some children came here.,1.0
3284,Raymond drove to Harvard University.,Raymond driven to Harvard University.,0.0
3285,Keith took these birds.,Keith taken these birds.,0.0
3286,Carrie went to some malls.,Carrie gone to some malls.,0.0
3287,Tamara went to a cafe.,Tamara gone to a cafe.,0.0
3288,Michelle went to the closet.,Michelle gone to the closet.,0.0
3289,Janet broken the plane.,Janet broke the plane.,1.0
3290,Gerald hidden Ann.,Gerald hid Ann.,1.0
3291,Vincent driven to those restaurants.,Vincent drove to those restaurants.,1.0
3292,Kirsten broke a dish.,Kirsten broken a dish.,0.0
3293,Patrick forgot Victoria.,Patrick forgotten Victoria.,0.0
3294,The Clintons wore this coat.,The Clintons worn this coat.,0.0
3295,Maria worn jackets.,Maria wore jackets.,1.0
3296,This guy came here.,This guy come here.,0.0
3297,Tamara hidden.,Tamara hid.,1.0
3298,Bethany broken a lot of cups.,Bethany broke a lot of cups.,1.0
3299,Those dancers woke up.,Those dancers woken up.,0.0
3300,Some dog stunned these committee.,Some dog stunned this committee.,1.0
3301,Tracy passed these art galleries.,Tracy passed this art galleries.,0.0
3302,Sarah has sounded like this children.,Sarah has sounded like these children.,1.0
3303,Craig had cared for those dancer.,Craig had cared for that dancer.,1.0
3304,Most children return to those senators.,Most children return to that senators.,0.0
3305,The Impressionists impress those hospitals.,The Impressionists impress that hospitals.,0.0
3306,Carl cures those horses.,Carl cures that horses.,0.0
3307,The Borgias should pass these college campuses.,The Borgias should pass this college campuses.,0.0
3308,Natalie had passed that public parks.,Natalie had passed those public parks.,1.0
3309,All grocery stores didn't shock this adults.,All grocery stores didn't shock these adults.,1.0
3310,This person bothered this libraries.,This person bothered these libraries.,1.0
3311,This actress isn't taking those dress.,This actress isn't taking that dress.,1.0
3312,The turtle alarmed this legislatures.,The turtle alarmed these legislatures.,1.0
3313,The Borgias attack that customers.,The Borgias attack those customers.,1.0
3314,Jerry messes up this chairs.,Jerry messes up these chairs.,1.0
3315,Sally thinks about that story.,Sally thinks about those story.,0.0
3316,Frank doesn't upset that actress.,Frank doesn't upset those actress.,0.0
3317,Amelia doesn't return to those hospitals.,Amelia doesn't return to that hospitals.,0.0
3318,Christopher hated those stories.,Christopher hated that stories.,0.0
3319,This mouth astounds this actresses.,This mouth astounds these actresses.,1.0
3320,Tiffany insults that movies.,Tiffany insults those movies.,1.0
3321,That book confuses those cashier.,That book confuses that cashier.,1.0
3322,Sabrina doesn't tour this cafes.,Sabrina doesn't tour these cafes.,1.0
3323,An actor would drop by this bank.,An actor would drop by these bank.,0.0
3324,Boys hadn't criticized those high school.,Boys hadn't criticized that high school.,1.0
3325,The Borgias discuss that cashiers.,The Borgias discuss those cashiers.,1.0
3326,The guy researches this brochure.,The guy researches these brochure.,0.0
3327,Carl references these essay.,Carl references this essay.,1.0
3328,Robert hates that dancer.,Robert hates those dancer.,0.0
3329,Erin fires those waiter.,Erin fires that waiter.,1.0
3330,Sherry was selling those hamsters.,Sherry was selling that hamsters.,0.0
3331,This cilantro hurt that senators.,This cilantro hurt those senators.,1.0
3332,Some drawing won't bother those girl.,Some drawing won't bother that girl.,1.0
3333,Stacey hadn't criticized these college campuses.,Stacey hadn't criticized this college campuses.,0.0
3334,Russell had revealed this student.,Russell had revealed these student.,0.0
3335,Theresa revealed that cashier.,Theresa revealed those cashier.,0.0
3336,Caroline doesn't wear these glove.,Caroline doesn't wear this glove.,1.0
3337,Alan questioned these hospital.,Alan questioned this hospital.,1.0
3338,Sheila had exited this high school.,Sheila had exited these high school.,0.0
3339,Boys exit that hospital.,Boys exit those hospital.,0.0
3340,Joseph cleans these art gallery.,Joseph cleans this art gallery.,1.0
3341,Ellen cleans these plate.,Ellen cleans this plate.,1.0
3342,Some woman discusses these reports.,Some woman discusses this reports.,0.0
3343,Most waiters describe these pedestrian.,Most waiters describe this pedestrian.,1.0
3344,Omar fixed that couches.,Omar fixed those couches.,1.0
3345,The Impressionists worked with this teenagers.,The Impressionists worked with these teenagers.,1.0
3346,Elizabeth didn't resemble this drawings.,Elizabeth didn't resemble these drawings.,1.0
3347,Alicia can flee from that waitresses.,Alicia can flee from those waitresses.,1.0
3348,All public parks should stun that actresses.,All public parks should stun those actresses.,1.0
3349,Jerry fires those guys.,Jerry fires that guys.,0.0
3350,Teresa shouldn't upset these companies.,Teresa shouldn't upset this companies.,0.0
3351,Diana isn't stunning that student.,Diana isn't stunning those student.,0.0
3352,Many girls return to that school.,Many girls return to those school.,0.0
3353,Victoria finds this book.,Victoria finds these book.,0.0
3354,Lawrence was buying these schools.,Lawrence was buying this schools.,0.0
3355,This sock didn't upset those waitress.,This sock didn't upset that waitress.,1.0
3356,John is questioning these students.,John is questioning this students.,0.0
3357,Patrick irritated this company.,Patrick irritated these company.,0.0
3358,Every pedestrian did take these library.,Every pedestrian did take this library.,1.0
3359,Dennis bothered those hospitals.,Dennis bothered that hospitals.,0.0
3360,Many planes disturb that teenager.,Many planes disturb those teenager.,0.0
3361,All girls have run around this high school.,All girls have run around these high school.,0.0
3362,Michael hasn't scanned these plays.,Michael hasn't scanned this plays.,0.0
3363,Larry is taking those mall.,Larry is taking that mall.,1.0
3364,Kristen hadn't broken this plates.,Kristen hadn't broken these plates.,1.0
3365,Most guys reveal that cup.,Most guys reveal those cup.,0.0
3366,Carlos hadn't questioned that universities.,Carlos hadn't questioned those universities.,1.0
3367,Rose leaves this teachers.,Rose leaves these teachers.,1.0
3368,Colleen hasn't fixed that chairs.,Colleen hasn't fixed those chairs.,1.0
3369,Martha wasn't leaving this guests.,Martha wasn't leaving these guests.,1.0
3370,Winston Churchill hadn't worked with that guy.,Winston Churchill hadn't worked with those guy.,0.0
3371,Chad concealed this waiter.,Chad concealed these waiter.,0.0
3372,Laura exits those grocery stores.,Laura exits that grocery stores.,0.0
3373,Some actors astounded that banks.,Some actors astounded those banks.,1.0
3374,Harvard University is irritating these dancers.,Harvard University is irritating this dancers.,0.0
3375,Galileo might impress this student.,Galileo might impress these student.,0.0
3376,The Borgias pass those museums.,The Borgias pass that museums.,0.0
3377,Every committee talks about that story.,Every committee talks about those story.,0.0
3378,Those closets alarm this museum.,Those closets alarm these museum.,0.0
3379,A drawing annoys this pedestrian.,A drawing annoys these pedestrian.,0.0
3380,Theresa has this jacket.,Theresa has these jacket.,0.0
3381,All cafes embarrassed those governments.,All cafes embarrassed that governments.,0.0
3382,Denise won't hate that pedestrian.,Denise won't hate those pedestrian.,0.0
3383,Lissa drove to that art galleries.,Lissa drove to those art galleries.,1.0
3384,Rodney approaches that driver.,Rodney approaches those driver.,0.0
3385,Nina hurt those guy.,Nina hurt that guy.,1.0
3386,Beverly hasn't dropped by those cafe.,Beverly hasn't dropped by that cafe.,1.0
3387,Phillip hadn't worn that coat.,Phillip hadn't worn those coat.,0.0
3388,Sarah couldn't examine that story.,Sarah couldn't examine those story.,0.0
3389,Those actors conceal these dancers.,Those actors conceal this dancers.,0.0
3390,Laurie can break these cup.,Laurie can break this cup.,1.0
3391,Stephen isn't criticizing this library.,Stephen isn't criticizing these library.,0.0
3392,Allison doesn't watch this actor.,Allison doesn't watch these actor.,0.0
3393,This waitress insulted those adult.,This waitress insulted that adult.,1.0
3394,Liam buys these restaurant.,Liam buys this restaurant.,1.0
3395,Tonya hasn't arrived at that hospital.,Tonya hasn't arrived at those hospital.,0.0
3396,George doesn't pass these mall.,George doesn't pass this mall.,1.0
3397,Actors conceal this coats.,Actors conceal these coats.,1.0
3398,Actors can break this chair.,Actors can break these chair.,0.0
3399,Marla will attack these teachers.,Marla will attack this teachers.,0.0
3400,Donald can imagine those college campuses are boring themselves.,Donald can imagine those college campuses are boring himself.,0.0
3401,Gerald was explaining Patricia was revealing herself.,Gerald was explaining Patricia was revealing himself.,0.0
3402,Mark imagines Erin might admire himself.,Mark imagines Erin might admire herself.,1.0
3403,Gary imagined most reports upset himself.,Gary imagined most reports upset themselves.,1.0
3404,A lot of doctors hadn't imagined Denise notices themselves.,A lot of doctors hadn't imagined Denise notices herself.,1.0
3405,Edward didn't think some teachers weren't discussing himself.,Edward didn't think some teachers weren't discussing themselves.,1.0
3406,The Borgias explain Scott had talked to themselves.,The Borgias explain Scott had talked to himself.,1.0
3407,Valerie doesn't think Russell sounds like himself.,Valerie doesn't think Russell sounds like herself.,0.0
3408,Craig hasn't thought Jessica praised herself.,Craig hasn't thought Jessica praised himself.,0.0
3409,Holly would say some slope didn't irritate itself.,Holly would say some slope didn't irritate herself.,0.0
3410,Sally wouldn't explain Rodney confused himself.,Sally wouldn't explain Rodney confused herself.,0.0
3411,The dancer said Jeffrey doesn't find himself.,The dancer said Jeffrey doesn't find herself.,0.0
3412,Beverly had said Homer was concealing herself.,Beverly had said Homer was concealing himself.,1.0
3413,The Impressionists think that window distracted themselves.,The Impressionists think that window distracted itself.,1.0
3414,Those waitresses say Curtis hadn't alarmed himself.,Those waitresses say Curtis hadn't alarmed themselves.,0.0
3415,Guy does explain Judy argued about herself.,Guy does explain Judy argued about himself.,0.0
3416,James says Kayla helped himself.,James says Kayla helped herself.,1.0
3417,Joel can't explain some girl can't visit herself.,Joel can't explain some girl can't visit himself.,0.0
3418,Victoria thinks Harvard University isn't firing herself.,Victoria thinks Harvard University isn't firing itself.,1.0
3419,Alice has said Craig did upset himself.,Alice has said Craig did upset herself.,0.0
