,sent_a,sent_b,label
1536,Randolf was cared for by the drawing.,Randolf was cared for by the waiter.,1.0
1537,Janet was fired by some offspring.,Janet was fired by some scarves.,0.0
1538,Russell wasn't referenced by some girl.,Russell wasn't referenced by some hat.,0.0
1539,Carmen is talked about by the waiters.,Carmen is talked about by the essay.,0.0
1540,A story wasn't scanned by the newspaper article.,A story wasn't scanned by the doctor.,1.0
1541,Sherry wasn't criticized by some casseroles.,Sherry wasn't criticized by some customers.,1.0
1542,Joseph isn't praised by the pedestrians.,Joseph isn't praised by the hypothesis.,0.0
1543,Gregory wasn't helped by some teenager.,Gregory wasn't helped by some legislature.,0.0
1544,Every student was listened to by some rabbit.,Every student was listened to by some guys.,1.0
1545,Mitchell isn't hated by some brochures.,Mitchell isn't hated by some man.,1.0
1546,Those stairs aren't climbed down by the dress.,Those stairs aren't climbed down by the cashiers.,1.0
1547,Some mushrooms were brought by the actors.,Some mushrooms were brought by the carts.,0.0
1548,Most children aren't listened to by some girls.,Most children aren't listened to by some fungus.,0.0
1549,Teresa is attacked by some cacti.,Teresa is attacked by some child.,1.0
1550,A hospital is exited by some coats.,A hospital is exited by some adults.,1.0
1551,These actresses were referenced by some lady.,These actresses were referenced by some box.,0.0
1552,Stacey wasn't fired by some geese.,Stacey wasn't fired by some guest.,1.0
1553,A mall is explored by the people.,A mall is explored by the beef.,0.0
1554,The women were kissed by some glasses.,The women were kissed by some teenagers.,1.0
1555,The commentaries weren't examined by some lady.,The commentaries weren't examined by some bike.,0.0
1556,Homer isn't described by the boys.,Homer isn't described by the snake.,0.0
1557,Spain is toured by the actress.,Spain is toured by the turtle.,0.0
1558,Some hills aren't climbed down by some government.,Some hills aren't climbed down by some drivers.,1.0
1559,Aaron isn't referenced by the picture.,Aaron isn't referenced by the teacher.,1.0
1560,Carolyn is referenced by some book.,Carolyn is referenced by some adults.,1.0
1561,Donna wasn't disliked by the patients.,Donna wasn't disliked by the apple.,0.0
1562,The commentaries weren't scanned by the snake.,The commentaries weren't scanned by the patient.,1.0
1563,Many grocery stores are passed by the trucks.,Many grocery stores are passed by the children.,1.0
1564,Some book isn't scanned by some dancer.,Some book isn't scanned by some reports.,0.0
1565,Julia was talked to by the sheep.,Julia was talked to by the lady.,1.0
1566,A lot of malls are exited by some screens.,A lot of malls are exited by some children.,1.0
1567,Mitchell was discussed by some pork.,Mitchell was discussed by some boy.,1.0
1568,Kevin was loved by the broccoli.,Kevin was loved by the teenagers.,1.0
1569,The cafes aren't appreciated by some driver.,The cafes aren't appreciated by some ellipsis.,0.0
1570,Many glasses aren't cleaned by the men.,Many glasses aren't cleaned by the committees.,0.0
1571,Cilantro wasn't hidden by some fish.,Cilantro wasn't hidden by some teacher.,1.0
1572,That hill is seen by the children.,That hill is seen by the rabbits.,0.0
1573,Debra wasn't admired by the geese.,Debra wasn't admired by the drivers.,1.0
1574,These sketches were researched by some axes.,These sketches were researched by some girls.,1.0
1575,Bethany isn't thought about by the windows.,Bethany isn't thought about by the ladies.,1.0
1576,A grocery store is researched by the ellipsis.,A grocery store is researched by the actor.,1.0
1577,That cafe isn't driven to by some teachers.,That cafe isn't driven to by some documentary.,0.0
1578,Spain wasn't toured by some company.,Spain wasn't toured by some customer.,1.0
1579,That ladder wasn't descended by the convertibles.,That ladder wasn't descended by the cashier.,1.0
1580,Thomas wasn't hugged by some projectors.,Thomas wasn't hugged by some guest.,1.0
1581,That fish is taken by the teacher.,That fish is taken by the series.,0.0
1582,This art gallery wasn't passed by some teeth.,This art gallery wasn't passed by some woman.,1.0
1583,These unicycles are seen by the deer.,These unicycles are seen by the guests.,1.0
1584,Timothy was praised by the geese.,Timothy was praised by the waitresses.,1.0
1585,Curtis is concealed by some teenager.,Curtis is concealed by some paralysis.,0.0
1586,These universities were boycotted by some mirrors.,These universities were boycotted by some lady.,1.0
1587,Many malls aren't messed up by some actresses.,Many malls aren't messed up by some skateboards.,0.0
1588,Deanna isn't boasted about by some waiters.,Deanna isn't boasted about by some wheelbarrows.,0.0
1589,Jacqueline was talked to by the cashiers.,Jacqueline was talked to by the feet.,0.0
1590,That patient wasn't helped by the reports.,That patient wasn't helped by the boy.,1.0
1591,Deborah isn't watched by some children.,Deborah isn't watched by some fish.,0.0
1592,Some hill was escaped from by the actresses.,Some hill was escaped from by the fungus.,0.0
1593,Theodore is referenced by some muffins.,Theodore is referenced by some driver.,1.0
1594,Every skateboard isn't lifted by the oxen.,Every skateboard isn't lifted by the man.,1.0
1595,All public parks were explored by some teenager.,All public parks were explored by some screen.,0.0
1596,This cake is seen by the pedestrians.,This cake is seen by the parentheses.,0.0
1597,Every person wasn't cared for by the offspring.,Every person wasn't cared for by the fungus.,0.0
1598,Edward wasn't insulted by some alumni.,Edward wasn't insulted by some oxen.,0.0
1599,Brad was investigated by the rabbits.,Brad was investigated by the actresses.,1.0
1600,Who aren't most hospitals that hadn't talked about most waitresses alarming?,Who aren't most waitresses alarming most hospitals that hadn't talked about?,0.0
1601,Who hasn't Cheryl attacked this sister of these dancers who shocked?,Who hasn't this sister of these dancers who shocked Cheryl attacked?,1.0
1602,Who should some grandsons of Janice hate Lawrence's lawyers who have scared?,Who should Lawrence's lawyers who have scared some grandsons of Janice hate?,1.0
1603,Who hadn't some driver who would fire Jennifer's colleague embarrassed?,Who hadn't Jennifer's colleague embarrassed some driver who would fire?,0.0
1604,Who haven't these fathers of Gerald who impressed Deborah's tutors loved?,Who haven't Deborah's tutors loved these fathers of Gerald who impressed?,0.0
1605,Who couldn't Carmen observe nephews of Victoria that did conceal?,Who couldn't nephews of Victoria that did conceal Carmen observe?,1.0
1606,Who wouldn't all mothers of Florence who disturbed Katherine forget?,Who wouldn't Katherine forget all mothers of Florence who disturbed?,0.0
1607,Who couldn't some teacher's piano teachers that were criticizing a movie about politics upset?,Who couldn't a movie about politics upset some teacher's piano teachers that were criticizing?,0.0
1608,Who weren't the dancers admiring these people that had hated?,Who weren't these people that had hated the dancers admiring?,1.0
1609,Who did Anna's dentists disturb this actor that wouldn't astound?,Who did this actor that wouldn't astound Anna's dentists disturb?,1.0
1610,Who was Tonya approaching Gary's lawyer who could respect?,Who was Gary's lawyer who could respect Tonya approaching?,1.0
1611,Who haven't Tonya's daughters questioned Edward's plumbers that had listened to?,Who haven't Edward's plumbers that had listened to Tonya's daughters questioned?,1.0
1612,What can't some actor argue about a guest who would like?,What can't a guest who would like some actor argue about?,1.0
1613,Who wasn't Samuel healing that actor's father who can't bore?,Who wasn't that actor's father who can't bore Samuel healing?,1.0
1614,Who was Andrew's ex-wife who isn't insulting Kevin approaching?,Who was Kevin approaching Andrew's ex-wife who isn't insulting?,0.0
1615,Who is Bill's nephew that won't attack Janice listening to?,Who is Janice listening to Bill's nephew that won't attack?,0.0
1616,Who is that cashier who knew that actress's podiatrist thinking about?,Who is that actress's podiatrist thinking about that cashier who knew?,0.0
1617,Who isn't Kathleen confusing the cousin of Craig that wasn't talking to?,Who isn't the cousin of Craig that wasn't talking to Kathleen confusing?,1.0
1618,Who hadn't these actresses' grandmothers described a brother of Renee who was upsetting?,Who hadn't a brother of Renee who was upsetting these actresses' grandmothers described?,1.0
1619,Who hadn't Daniel found Steven's brothers who had seen?,Who hadn't Steven's brothers who had seen Daniel found?,1.0
1620,What can't Anne admire a lot of fathers of Monet that liked?,What can't a lot of fathers of Monet that liked Anne admire?,1.0
1621,Who had some libraries listened to Joel's dermatologists who did flee from?,Who had Joel's dermatologists who did flee from some libraries listened to?,1.0
1622,Who hadn't Meredith's employee cared for Lissa's piano teachers who wouldn't return to?,Who hadn't Lissa's piano teachers who wouldn't return to Meredith's employee cared for?,1.0
1623,What does a patient conceal Cynthia's grandmother who won't love?,What does Cynthia's grandmother who won't love a patient conceal?,1.0
1624,Who couldn't a lot of cousins of many actors that were watching this guest observe?,Who couldn't this guest observe a lot of cousins of many actors that were watching?,0.0
1625,Who are a lot of students astounding a lot of universities that were talking to?,Who are a lot of universities that were talking to a lot of students astounding?,1.0
1626,Who might every senator's associates love Emily's French teachers that weren't watching?,Who might Emily's French teachers that weren't watching every senator's associates love?,1.0
1627,Who can't senators that should visit Regina's supervisor kiss?,Who can't Regina's supervisor kiss senators that should visit?,0.0
1628,Who had some ladies that had hired Omar returned to?,Who had Omar returned to some ladies that had hired?,0.0
1629,Who hadn't Theodore's nephew that had appreciated every report sounded like?,Who hadn't every report sounded like Theodore's nephew that had appreciated?,0.0
1630,Who was Brenda's contractor that attacked Regina hugging?,Who was Regina hugging Brenda's contractor that attacked?,0.0
1631,Who hasn't Holly's plumber who was curing Amanda scared?,Who hasn't Amanda scared Holly's plumber who was curing?,0.0
1632,Who isn't Diana's partner that isn't distracting Melinda finding?,Who isn't Melinda finding Diana's partner that isn't distracting?,0.0
1633,Who were a lot of boys annoying Florence's oncologists that revealed?,Who were Florence's oncologists that revealed a lot of boys annoying?,1.0
1634,Who aren't the mothers of Tina who hid the windows bothering?,Who aren't the windows bothering the mothers of Tina who hid?,0.0
1635,Who would that university that appreciates those schools irritate?,Who would those schools irritate that university that appreciates?,0.0
1636,Who can't Allison observe Galileo's sister that doesn't notice?,Who can't Galileo's sister that doesn't notice Allison observe?,1.0
1637,Who wouldn't Noah's lawyer who hadn't disagreed with James observe?,Who wouldn't James observe Noah's lawyer who hadn't disagreed with?,0.0
1638,Who had ladies who boasted about Danielle astounded?,Who had Danielle astounded ladies who boasted about?,0.0
1639,Who hasn't some son of Grace who alarmed Tanya's daughter embarrassed?,Who hasn't Tanya's daughter embarrassed some son of Grace who alarmed?,0.0
1640,What weren't all dancers discovering Janice's ex-boyfriends that discovered?,What weren't Janice's ex-boyfriends that discovered all dancers discovering?,1.0
1641,Who is a woman who insults this student praising?,Who is this student praising a woman who insults?,0.0
1642,Who are Gina's best friends that are boasting about the customers hugging?,Who are the customers hugging Gina's best friends that are boasting about?,0.0
1643,What hasn't Jesus's associate that loved Edward thought about?,What hasn't Edward thought about Jesus's associate that loved?,0.0
1644,Who isn't the nephew of Ella that praises Mitchell curing?,Who isn't Mitchell curing the nephew of Ella that praises?,0.0
1645,Who is Jennifer's best friend hugging every waiter who listens to?,Who is every waiter who listens to Jennifer's best friend hugging?,1.0
1646,Who should that actress who will question Mitchell remember?,Who should Mitchell remember that actress who will question?,0.0
1647,What has Stephanie healed this teacher that can't find?,What has this teacher that can't find Stephanie healed?,1.0
1648,Who was Nicole talking about Gary's dentist who could embarrass?,Who was Gary's dentist who could embarrass Nicole talking about?,1.0
1649,Who hadn't Patrick talked about some friend of Melissa that has attacked?,Who hadn't some friend of Melissa that has attacked Patrick talked about?,1.0
1650,Who hadn't Martin worked with a niece of Guy that remembers?,Who hadn't a niece of Guy that remembers Martin worked with?,1.0
1651,Who hadn't a lot of waiters that hadn't insulted Vincent listened to?,Who hadn't Vincent listened to a lot of waiters that hadn't insulted?,0.0
1652,Who aren't Aaron's grandsons that had talked about Patrick's piano teachers hurting?,Who aren't Patrick's piano teachers hurting Aaron's grandsons that had talked about?,0.0
1653,Who wasn't Dan's boss who listened to those cashiers' daughter astounding?,Who wasn't those cashiers' daughter astounding Dan's boss who listened to?,0.0
1654,Who hadn't some teacher who wasn't stunning Spain hired?,Who hadn't Spain hired some teacher who wasn't stunning?,0.0
1655,Who weren't some doctors disagreeing with these pedestrians that were distracting?,Who weren't these pedestrians that were distracting some doctors disagreeing with?,1.0
1656,Who won't all cashiers' father that is irritating Pamela talk about?,Who won't Pamela talk about all cashiers' father that is irritating?,0.0
1657,Who has Wendy's boss that fled from Tiffany argued about?,Who has Tiffany argued about Wendy's boss that fled from?,0.0
1658,Who isn't some guest that isn't hurting Phillip hiring?,Who isn't Phillip hiring some guest that isn't hurting?,0.0
1659,Who was Susan's guest escaping from Beverly's sister that admired?,Who was Beverly's sister that admired Susan's guest escaping from?,1.0
1660,Who had Allison kissed a doctor that should scare?,Who had a doctor that should scare Allison kissed?,1.0
1661,Who are the nephews of Keith talking to Marie's ex-boyfriends who weren't hugging?,Who are Marie's ex-boyfriends who weren't hugging the nephews of Keith talking to?,1.0
1662,Who hadn't this boy criticized most schools that hadn't shocked?,Who hadn't most schools that hadn't shocked this boy criticized?,1.0
1663,Who hasn't William sounded like Carl's doctor that referenced?,Who hasn't Carl's doctor that referenced William sounded like?,1.0
1664,Who haven't Liam's cousins watched these fathers of Julie who weren't investigating?,Who haven't these fathers of Julie who weren't investigating Liam's cousins watched?,1.0
1665,Who hasn't Tara concealed Karen's hairdresser that would fire?,Who hasn't Karen's hairdresser that would fire Tara concealed?,1.0
1666,Who couldn't some senator alarm this guy that has kissed?,Who couldn't this guy that has kissed some senator alarm?,1.0
1667,Who has Theresa's grandmother who respects Thomas's grandmother seen?,Who has Thomas's grandmother seen Theresa's grandmother who respects?,0.0
1668,Who were some ladies discussing Tonya's colleagues who were investigating?,Who were Tonya's colleagues who were investigating some ladies discussing?,1.0
1669,What hadn't Eric referenced some cousins of Thomas that are arguing about?,What hadn't some cousins of Thomas that are arguing about Eric referenced?,1.0
1670,Who hasn't a granddaughter of Andrea that visits Martha astounded?,Who hasn't Martha astounded a granddaughter of Andrea that visits?,0.0
1671,Who aren't all men who investigated nephews of Lori kissing?,Who aren't nephews of Lori kissing all men who investigated?,0.0
1672,Who weren't Steven's dermatologists questioning a lot of sisters of Randolf who could praise?,Who weren't a lot of sisters of Randolf who could praise Steven's dermatologists questioning?,1.0
1673,What wasn't William appreciating Kevin's mentee that hates?,What wasn't Kevin's mentee that hates William appreciating?,1.0
1674,Who hadn't every woman that concealed Irene's classmates hired?,Who hadn't Irene's classmates hired every woman that concealed?,0.0
1675,Who has Cheryl loved Beth's handyman that was hugging?,Who has Beth's handyman that was hugging Cheryl loved?,1.0
1676,What had Marcus's dentists praised Melinda's podiatrist that hasn't complained about?,What had Melinda's podiatrist that hasn't complained about Marcus's dentists praised?,1.0
1677,Who haven't these teenagers who weren't disagreeing with some teenagers helped?,Who haven't some teenagers helped these teenagers who weren't disagreeing with?,0.0
1678,Who haven't the Borgias concealed Roger's ex-girlfriends that do talk to?,Who haven't Roger's ex-girlfriends that do talk to the Borgias concealed?,1.0
1679,Who should Jerry confuse the grandfather of Daniel who had seen?,Who should the grandfather of Daniel who had seen Jerry confuse?,1.0
1680,Who wouldn't Sarah stun Stephen's mother who will like?,Who wouldn't Stephen's mother who will like Sarah stun?,1.0
1681,Who weren't Janice's supervisors boring Anna's colleagues who haven't revealed?,Who weren't Anna's colleagues who haven't revealed Janice's supervisors boring?,1.0
1682,Who haven't Valerie's guests hugged these ladies' dermatologists who were shocking?,Who haven't these ladies' dermatologists who were shocking Valerie's guests hugged?,1.0
1683,What does Theodore like that guy's spouse that shouldn't forget?,What does that guy's spouse that shouldn't forget Theodore like?,1.0
1684,Who were the Clintons' employees who weren't leaving Sharon's French teachers boring?,Who were Sharon's French teachers boring the Clintons' employees who weren't leaving?,0.0
1685,Who doesn't that brother of Wayne that wasn't stunning Wayne work with?,Who doesn't Wayne work with that brother of Wayne that wasn't stunning?,0.0
1686,Who could these doctors shock some guests who talked to?,Who could some guests who talked to these doctors shock?,1.0
1687,Who would Julia like Stephanie's students who talked to?,Who would Stephanie's students who talked to Julia like?,1.0
1688,Who didn't Linda's mentor that hasn't referenced Amanda reveal?,Who didn't Amanda reveal Linda's mentor that hasn't referenced?,0.0
1689,Who hadn't Tonya's sister scared some pedestrians who disagreed with?,Who hadn't some pedestrians who disagreed with Tonya's sister scared?,1.0
1690,Who aren't all guys that can see those hospitals scaring?,Who aren't those hospitals scaring all guys that can see?,0.0
1691,Who isn't a nephew of a lot of actors complaining about this child who might work with?,Who isn't this child who might work with a nephew of a lot of actors complaining about?,1.0
1692,Who won't a teenager's plumber approach Travis's French teacher that hasn't upset?,Who won't Travis's French teacher that hasn't upset a teenager's plumber approach?,1.0
1693,Who hadn't Lissa cared for Edward's girlfriend who likes?,Who hadn't Edward's girlfriend who likes Lissa cared for?,1.0
1694,Who have Rachel's bosses found all rabbits that couldn't scare?,Who have all rabbits that couldn't scare Rachel's bosses found?,1.0
1695,Who is that woman helping Rachelle's brother who has approached?,Who is Rachelle's brother who has approached that woman helping?,1.0
1696,Who had Mary's ex-husbands hurt every cousin of Florence who can't astound?,Who had every cousin of Florence who can't astound Mary's ex-husbands hurt?,1.0
1697,Who has the man observed every friend of Beth that disagrees with?,Who has every friend of Beth that disagrees with the man observed?,1.0
1698,Who wouldn't Brett's contractors that couldn't boast about Kayla's supervisor bore?,Who wouldn't Kayla's supervisor bore Brett's contractors that couldn't boast about?,0.0
1699,Who weren't these grandmothers of Roger that don't bore Michelle's handymen questioning?,Who weren't Michelle's handymen questioning these grandmothers of Roger that don't bore?,0.0
1700,Rebecca was criticizing those good documentary.,Rebecca was criticizing those good documentaries.,1.0
1701,Some college campus embarrassed those bad legislatures.,Some college campus embarrassed those bad legislature.,0.0
1702,All men weren't questioning these unemployed cashiers.,All men weren't questioning these unemployed cashier.,0.0
1703,Sara hasn't bored this displeased senator.,Sara hasn't bored this displeased senators.,0.0
1704,A lot of pedestrians kiss this displeased teenager.,A lot of pedestrians kiss this displeased teenagers.,0.0
1705,James is healing this uncertain actresses.,James is healing this uncertain actress.,1.0
1706,Diane should complain about these unconvinced drivers.,Diane should complain about these unconvinced driver.,0.0
1707,Phillip liked that smooth horse.,Phillip liked that smooth horses.,0.0
1708,Tracy praises those lucky guy.,Tracy praises those lucky guys.,1.0
1709,A doctor had returned to these fast girls.,A doctor had returned to these fast girl.,0.0
1710,A lot of drawings had irritated those clean hospitals.,A lot of drawings had irritated those clean hospital.,0.0
1711,Many customers do clean those yellow plate.,Many customers do clean those yellow plates.,1.0
1712,Scott hadn't fired that uncertain actor.,Scott hadn't fired that uncertain actors.,0.0
1713,Many men have these messy cup.,Many men have these messy cups.,1.0
1714,Martha shouldn't upset these excited doctor.,Martha shouldn't upset these excited doctors.,1.0
1715,Many teachers should appreciate that bad plays.,Many teachers should appreciate that bad play.,1.0
1716,All bikes embarrass those uncertain teenagers.,All bikes embarrass those uncertain teenager.,0.0
1717,Bruce criticizes that happy lady.,Bruce criticizes that happy ladies.,0.0
1718,Some man hugs these good actress.,Some man hugs these good actresses.,1.0
1719,Turtles aggravated these important associations.,Turtles aggravated these important association.,0.0
1720,Tara fired that uncertain cashier.,Tara fired that uncertain cashiers.,0.0
1721,Becca isn't dropping by this brown art gallery.,Becca isn't dropping by this brown art galleries.,0.0
1722,James was approaching these bad doctor.,James was approaching these bad doctors.,1.0
1723,Those associations will have these old libraries.,Those associations will have these old library.,0.0
1724,A lot of guests notice that troubled waiter.,A lot of guests notice that troubled waiters.,0.0
1725,Tamara attacked these bad boys.,Tamara attacked these bad boy.,0.0
1726,Jesus wears these big shawls.,Jesus wears these big shawl.,0.0
1727,Tara appreciates these displeased teenager.,Tara appreciates these displeased teenagers.,1.0
1728,Many adults question this bad association.,Many adults question this bad associations.,0.0
1729,Men help these uncertain teachers.,Men help these uncertain teacher.,0.0
1730,Jessica investigated these standing dancer.,Jessica investigated these standing dancers.,1.0
1731,Catherine went to this rough art gallery.,Catherine went to this rough art galleries.,0.0
1732,Every drawing annoys that popular pedestrians.,Every drawing annoys that popular pedestrian.,1.0
1733,Rhonda forgot these sick teenager.,Rhonda forgot these sick teenagers.,1.0
1734,Jodi hated these smart guests.,Jodi hated these smart guest.,0.0
1735,Some adults distracts that popular schools.,Some adults distracts that popular school.,1.0
1736,Diana couldn't reveal this important actress.,Diana couldn't reveal this important actresses.,0.0
1737,Tonya helps these out in the open doctor.,Tonya helps these out in the open doctors.,1.0
1738,Joel was complaining about those small adult.,Joel was complaining about those small adults.,1.0
1739,All doctors arrive at these good movie theaters.,All doctors arrive at these good movie theater.,0.0
1740,These women reveal those good libraries.,These women reveal those good library.,0.0
1741,Jessica biked to these red cafe.,Jessica biked to these red cafes.,1.0
1742,Stephanie wasn't distracting those green school.,Stephanie wasn't distracting those green schools.,1.0
1743,That teenager hasn't investigated these fast children.,That teenager hasn't investigated these fast child.,0.0
1744,Kevin described those lost patient.,Kevin described those lost patients.,1.0
1745,A lot of libraries argue about this good brochure.,A lot of libraries argue about this good brochures.,0.0
1746,All museums hadn't known these upset senator.,All museums hadn't known these upset senators.,1.0
1747,Steve will reveal those uncertain boy.,Steve will reveal those uncertain boys.,1.0
1748,Dawn scans this good commentaries.,Dawn scans this good commentary.,1.0
1749,The cat resembled that red sketches.,The cat resembled that red sketch.,1.0
1750,That child sees these rough hospital.,That child sees these rough hospitals.,1.0
1751,Cindy was noticing that concealed rug.,Cindy was noticing that concealed rugs.,0.0
1752,Most customers liked those red picture.,Most customers liked those red pictures.,1.0
1753,Brenda hadn't fixed these broken glasses.,Brenda hadn't fixed these broken glass.,0.0
1754,Laura isn't firing this scared waitress.,Laura isn't firing this scared waitresses.,0.0
1755,Elizabeth shouldn't clean this green bank.,Elizabeth shouldn't clean this green banks.,0.0
1756,Winston Churchill approaches those displeased dancers.,Winston Churchill approaches those displeased dancer.,0.0
