,sent_a,sent_b,label
4962,Karen's lawyers who only that senator forgot should ever ascend these mountains.,Only Karen's lawyers who that senator forgot should ever ascend these mountains.,1.0
4963,Ronald's grandfather that only every doctor will leave ever wished to spin around.,Only Ronald's grandfather that every doctor will leave ever wished to spin around.,1.0
4964,Some glass that only Carolyn would find ever chipped.,Only some glass that Carolyn would find ever chipped.,1.0
4965,Debra's mentee that only a newspaper article upsets ever remembers Cynthia.,Only Debra's mentee that a newspaper article upsets ever remembers Cynthia.,1.0
4966,Only most schools that some actors were passing ever insult Vanessa.,Most schools that only some actors were passing ever insult Vanessa.,0.0
4967,Only this student who Rachel left could ever spur the children to know Sherry.,This student who only Rachel left could ever spur the children to know Sherry.,0.0
4968,Waitresses who only Pamela could approach ever pressure Russell to fall asleep.,Only waitresses who Pamela could approach ever pressure Russell to fall asleep.,1.0
4969,Only Tara's teachers who Sharon insulted ever intend to kiss the Impressionists.,Tara's teachers who only Sharon insulted ever intend to kiss the Impressionists.,0.0
4970,Only these computers that some women sell had ever looked like many sketches.,These computers that only some women sell had ever looked like many sketches.,0.0
4971,A truck that only Elizabeth was selling ever chips.,Only a truck that Elizabeth was selling ever chips.,1.0
4972,These boys' ex-girlfriends that only some girl remembers might ever encourage Patricia to return to Suzanne.,Only these boys' ex-girlfriends that some girl remembers might ever encourage Patricia to return to Suzanne.,1.0
4973,The teenagers who only Sheila has hidden ever refused to move.,Only the teenagers who Sheila has hidden ever refused to move.,1.0
4974,Claire's daughters that only this lady was insulting might ever go to that grocery store.,Only Claire's daughters that this lady was insulting might ever go to that grocery store.,1.0
4975,Only Allison's contractors who every restaurant astounds ever read.,Allison's contractors who only every restaurant astounds ever read.,0.0
4976,A lot of boys that only Craig was revealing ever negotiated.,Only a lot of boys that Craig was revealing ever negotiated.,1.0
4977,The daughter of every customer who only Cynthia thinks about ever drives to this glacier.,Only the daughter of every customer who Cynthia thinks about ever drives to this glacier.,1.0
4978,Christine's partners that only Bethany might respect could ever vanish.,Only Christine's partners that Bethany might respect could ever vanish.,1.0
4979,That actor that only the commentaries are disagreeing with ever yearns to train.,Only that actor that the commentaries are disagreeing with ever yearns to train.,1.0
4980,Only those grandmothers of Tara who Raymond visits ever fix that fork.,Those grandmothers of Tara who only Raymond visits ever fix that fork.,0.0
4981,Only the committee that these dancers bothers had ever coped.,The committee that only these dancers bothers had ever coped.,0.0
4982,All friends of Nina that only Thomas visited ever eat.,Only all friends of Nina that Thomas visited ever eat.,1.0
4983,That daughter of Carrie who only Christina might praise can ever explain the adults wouldn't struggle.,Only that daughter of Carrie who Christina might praise can ever explain the adults wouldn't struggle.,1.0
4984,Only most screens that Brian noticed could ever brighten.,Most screens that only Brian noticed could ever brighten.,0.0
4985,Only those associations that this tomato embarrassed ever fail to take an eye.,Those associations that only this tomato embarrassed ever fail to take an eye.,0.0
4986,Students' best friend that only most guys listen to has ever explained a student arrived at this museum.,Only students' best friend that most guys listen to has ever explained a student arrived at this museum.,1.0
4987,Kirsten's granddaughters that only Sharon was finding ever attempt to play.,Only Kirsten's granddaughters that Sharon was finding ever attempt to play.,1.0
4988,Only a lot of drivers that William has investigated ever alarm some bank.,A lot of drivers that only William has investigated ever alarm some bank.,0.0
4989,A pie that only Bruce lifted has ever existed.,Only a pie that Bruce lifted has ever existed.,1.0
4990,Only some projector that Kirsten lifts ever fades.,Some projector that only Kirsten lifts ever fades.,0.0
4991,Only Theodore's ex-wife that Kristin would care for could ever persuade a patient to hug Lucille.,Theodore's ex-wife that only Kristin would care for could ever persuade a patient to hug Lucille.,0.0
4992,Many grandmothers of Sara that only Cheryl scanned have ever learned what were shrinking.,Only many grandmothers of Sara that Cheryl scanned have ever learned what were shrinking.,1.0
4993,Those mouths that only Heidi admired can ever fling open.,Only those mouths that Heidi admired can ever fling open.,1.0
4994,Only Patrick's hairdressers who Walter had disliked might ever hug.,Patrick's hairdressers who only Walter had disliked might ever hug.,0.0
4995,Only Scott's dentists who April talked about ever flirt.,Scott's dentists who only April talked about ever flirt.,0.0
4996,Only Carlos's ex-girlfriends that all libraries can scare might ever pass a high school.,Carlos's ex-girlfriends that only all libraries can scare might ever pass a high school.,0.0
4997,Only Carl's teachers that Christine worked with have ever brought this window.,Carl's teachers that only Christine worked with have ever brought this window.,0.0
4998,Waiters that only Rose discovered have ever required Denise's nieces to hurt many ladies.,Only waiters that Rose discovered have ever required Denise's nieces to hurt many ladies.,1.0
4999,Most pants that only the Borgias liked can ever crumple.,Only most pants that the Borgias liked can ever crumple.,1.0
5000,The woman meet.,The women meet.,1.0
5001,The child isn't attacking Becky.,The children isn't attacking Becky.,0.0
5002,The woman cleans every public park.,The women cleans every public park.,0.0
5003,The man works with some pedestrian.,The men works with some pedestrian.,0.0
5004,The men have revealed Christina.,The man have revealed Christina.,0.0
5005,The men weren't benefiting.,The man weren't benefiting.,0.0
5006,The child haven't loved Julie.,The children haven't loved Julie.,1.0
5007,The women is skated around every art gallery.,The woman is skated around every art gallery.,1.0
5008,The child is breaking most plates.,The children is breaking most plates.,0.0
5009,The person was leaving.,The people was leaving.,0.0
5010,The teeth tip over.,The tooth tip over.,0.0
5011,The men have admired Ronald.,The man have admired Ronald.,0.0
5012,The people was firing James.,The person was firing James.,1.0
5013,The people conspire.,The person conspire.,0.0
5014,The person debate.,The people debate.,1.0
5015,The person is firing William.,The people is firing William.,0.0
5016,The alumnus has screamed.,The alumni has screamed.,0.0
5017,The person runs around some cafe.,The people runs around some cafe.,0.0
5018,The men is complaining.,The man is complaining.,1.0
5019,The analysis were disgusting Tammy.,The analyses were disgusting Tammy.,1.0
5020,The man hide Marcus.,The men hide Marcus.,1.0
5021,The people find Kristen.,The person find Kristen.,0.0
5022,The person wasn't kissing Mark.,The people wasn't kissing Mark.,0.0
5023,The man was learning.,The men was learning.,0.0
5024,The man leave.,The men leave.,1.0
5025,The men wasn't bringing most sketches.,The man wasn't bringing most sketches.,1.0
5026,The children have researched the Great Lakes.,The child have researched the Great Lakes.,0.0
5027,The women are negotiating.,The woman are negotiating.,0.0
5028,The person have seen.,The people have seen.,1.0
5029,The child wasn't saluting.,The children wasn't saluting.,0.0
5030,The women haven't chatted.,The woman haven't chatted.,0.0
5031,The women is shrugging.,The woman is shrugging.,1.0
5032,The alumnus was firing Carla.,The alumni was firing Carla.,0.0
5033,The theses were describing some ladies.,The thesis were describing some ladies.,0.0
5034,The person researches some lake.,The people researches some lake.,0.0
5035,The man cares for Richard.,The men cares for Richard.,0.0
5036,The man has concealed Jesus.,The men has concealed Jesus.,0.0
5037,The women appreciates Harvard University.,The woman appreciates Harvard University.,1.0
5038,The man laughs.,The men laughs.,0.0
5039,The synopses disagree with Randolf.,The synopsis disagree with Randolf.,0.0
5040,The men has respected Jodi.,The man has respected Jodi.,1.0
5041,The women boasts about Carolyn.,The woman boasts about Carolyn.,1.0
5042,The man aren't exploring Spain.,The men aren't exploring Spain.,1.0
5043,The alumnus concur.,The alumni concur.,1.0
5044,The child have corresponded.,The children have corresponded.,1.0
5045,The person weren't aggravating Janice.,The people weren't aggravating Janice.,1.0
5046,The person hasn't visited Tracy.,The people hasn't visited Tracy.,0.0
5047,The people like Helen.,The person like Helen.,0.0
5048,The person tours those banks.,The people tours those banks.,0.0
5049,The man see Christine.,The men see Christine.,1.0
5050,The tooth bore Christina.,The teeth bore Christina.,1.0
5051,The medium have disgusted Cindy.,The media have disgusted Cindy.,1.0
5052,The women hunt.,The woman hunt.,0.0
5053,The men salutes.,The man salutes.,1.0
5054,The men hurts Monica.,The man hurts Monica.,0.0
5055,The child watches Sandra.,The children watches Sandra.,0.0
5056,The alumni practice.,The alumnus practice.,0.0
5057,The men hug Eva.,The man hug Eva.,0.0
5058,The women wasn't concealing Wendy.,The woman wasn't concealing Wendy.,1.0
5059,The women was weeping.,The woman was weeping.,1.0
5060,The alumni has worked with Laura.,The alumnus has worked with Laura.,1.0
5061,The child cope.,The children cope.,1.0
5062,The woman hasn't run around the art gallery.,The women hasn't run around the art gallery.,0.0
5063,The people isn't blinking.,The person isn't blinking.,1.0
5064,The man exits this grocery store.,The men exits this grocery store.,0.0
5065,The women conceal this book.,The woman conceal this book.,0.0
5066,The woman has washed.,The women has washed.,0.0
5067,The children wasn't ascending a lot of mountains.,The child wasn't ascending a lot of mountains.,1.0
5068,The men spin around.,The man spin around.,0.0
5069,The person whisper.,The people whisper.,1.0
5070,The children aren't healing all guests.,The child aren't healing all guests.,0.0
5071,The women have forgotten Melanie.,The woman have forgotten Melanie.,0.0
5072,The men have listened to Stacy.,The man have listened to Stacy.,0.0
5073,The phenomenon alarm Cindy.,The phenomena alarm Cindy.,1.0
5074,The women arrive at the lake.,The woman arrive at the lake.,0.0
5075,The person aren't descending all mountains.,The people aren't descending all mountains.,1.0
5076,The men escapes.,The man escapes.,1.0
5077,The woman haven't remembered Tiffany.,The women haven't remembered Tiffany.,1.0
5078,The men succeed.,The man succeed.,0.0
5079,The women swallows.,The woman swallows.,1.0
5080,The cactus isn't bothering Kendra.,The cacti isn't bothering Kendra.,0.0
5081,The theses criticizes the malls.,The thesis criticizes the malls.,1.0
5082,The alumni have cured Nina.,The alumnus have cured Nina.,0.0
5083,The man bother Veronica.,The men bother Veronica.,1.0
5084,The person helps Teresa.,The people helps Teresa.,0.0
5085,The man has forfeited.,The men has forfeited.,0.0
5086,The alumni was cheering.,The alumnus was cheering.,1.0
5087,The person wears the hats.,The people wears the hats.,0.0
5088,The woman worry.,The women worry.,1.0
5089,The children have visited some guest.,The child have visited some guest.,0.0
5090,The hypothesis alarms Wendy.,The hypotheses alarms Wendy.,0.0
5091,The women researches Harvard University.,The woman researches Harvard University.,1.0
5092,The child plays.,The children plays.,0.0
5093,The men has grinned.,The man has grinned.,1.0
5094,The woman wasn't scratching.,The women wasn't scratching.,0.0
5095,The synopsis isn't moving.,The synopses isn't moving.,0.0
5096,The woman haven't skated around some school.,The women haven't skated around some school.,1.0
5097,The children has taken every icicle.,The child has taken every icicle.,1.0
5098,The children arrive at some mountain.,The child arrive at some mountain.,0.0
5099,The men were disturbing Randolf.,The man were disturbing Randolf.,0.0
5100,Steven explains Kayla won't hurt herself.,Kayla explains Steven won't hurt herself.,0.0
5101,Gina explains Alan fires himself.,Alan explains Gina fires himself.,0.0
5102,Alice did think Paul hugs herself.,Paul did think Alice hugs herself.,1.0
5103,Beverly imagines Carla's ex-boyfriend hates himself.,Carla's ex-boyfriend imagines Beverly hates himself.,0.0
5104,Randolf imagines Kayla sounds like herself.,Kayla imagines Randolf sounds like herself.,0.0
5105,Tonya explains Kevin would boast about himself.,Kevin explains Tonya would boast about himself.,0.0
5106,Adam can explain Katherine will describe herself.,Katherine can explain Adam will describe herself.,0.0
5107,Every guy could say Nancy hides himself.,Nancy could say every guy hides himself.,1.0
5108,Lawrence says Claire attacks himself.,Claire says Lawrence attacks himself.,1.0
5109,Donna explains Gerald could boast about himself.,Gerald explains Donna could boast about himself.,0.0
5110,Rachel did explain Steve couldn't praise himself.,Steve did explain Rachel couldn't praise himself.,0.0
5111,Caroline would imagine Jeffrey watches herself.,Jeffrey would imagine Caroline watches herself.,1.0
5112,Wayne should think Martha conceals himself.,Martha should think Wayne conceals himself.,1.0
5113,Maria imagines Bill praises himself.,Bill imagines Maria praises himself.,0.0
5114,Jill could explain Ronald will hide himself.,Ronald could explain Jill will hide himself.,0.0
5115,Teresa imagines Liam didn't distract himself.,Liam imagines Teresa didn't distract himself.,0.0
5116,Melanie couldn't imagine Andrew's father could conceal herself.,Andrew's father couldn't imagine Melanie could conceal herself.,1.0
5117,Carmen explains Carl might approach herself.,Carl explains Carmen might approach herself.,1.0
5118,Amelia should explain George kisses himself.,George should explain Amelia kisses himself.,0.0
5119,Eric says Susan helps himself.,Susan says Eric helps himself.,1.0
5120,Diane explains Laurie's boyfriend should remember himself.,Laurie's boyfriend explains Diane should remember himself.,0.0
5121,Sandra's boyfriend thinks Tanya talks about himself.,Tanya thinks Sandra's boyfriend talks about himself.,1.0
5122,Stacey doesn't explain that man doesn't help himself.,That man doesn't explain Stacey doesn't help himself.,0.0
5123,Tammy imagines Randolf doesn't alarm himself.,Randolf imagines Tammy doesn't alarm himself.,0.0
5124,Winston Churchill's son couldn't say Kayla loves himself.,Kayla couldn't say Winston Churchill's son loves himself.,1.0
5125,Adam can't imagine Brenda did leave himself.,Brenda can't imagine Adam did leave himself.,1.0
5126,Aaron thinks Elaine cares for himself.,Elaine thinks Aaron cares for himself.,1.0
5127,Guy thinks Tanya wouldn't sound like herself.,Tanya thinks Guy wouldn't sound like herself.,0.0
5128,Andrew imagines Laurie can't conceal himself.,Laurie imagines Andrew can't conceal himself.,1.0
5129,Dana could say Bradley will like herself.,Bradley could say Dana will like herself.,1.0
5130,Diane should say Russell notices herself.,Russell should say Diane notices herself.,1.0
5131,Kathleen says Samuel won't like himself.,Samuel says Kathleen won't like himself.,0.0
5132,Donna does imagine some boy could flee from himself.,Some boy does imagine Donna could flee from himself.,0.0
5133,Gerald should imagine Christina might know himself.,Christina should imagine Gerald might know himself.,1.0
5134,Travis thinks Grace doesn't embarrass himself.,Grace thinks Travis doesn't embarrass himself.,1.0
5135,Ronald couldn't think Debra listens to herself.,Debra couldn't think Ronald listens to herself.,0.0
5136,Renee thinks Frank might work with himself.,Frank thinks Renee might work with himself.,0.0
5137,Sarah does explain Rodney didn't think about himself.,Rodney does explain Sarah didn't think about himself.,0.0
5138,Pamela will think Andrew complains about herself.,Andrew will think Pamela complains about herself.,1.0
5139,Frank's ex-girlfriend thinks Douglas complains about himself.,Douglas thinks Frank's ex-girlfriend complains about himself.,0.0
5140,Paula's nephew can think Samuel's niece should annoy himself.,Samuel's niece can think Paula's nephew should annoy himself.,1.0
5141,Sara can't imagine David cures herself.,David can't imagine Sara cures herself.,1.0
5142,James can't explain Patricia conceals himself.,Patricia can't explain James conceals himself.,1.0
5143,Florence's grandmother imagines Bradley shouldn't stun himself.,Bradley imagines Florence's grandmother shouldn't stun himself.,0.0
5144,Kenneth will imagine Cheryl visits himself.,Cheryl will imagine Kenneth visits himself.,1.0
5145,Leslie won't explain Carlos works with himself.,Carlos won't explain Leslie works with himself.,0.0
5146,Holly explains Guy describes himself.,Guy explains Holly describes himself.,0.0
5147,Teresa explains Alan should reference himself.,Alan explains Teresa should reference himself.,0.0
5148,Leslie didn't think Samuel can care for herself.,Samuel didn't think Leslie can care for herself.,1.0
5149,Jason imagines Heather could praise herself.,Heather imagines Jason could praise herself.,0.0
5150,Carolyn's husband can explain David's sister didn't bother herself.,David's sister can explain Carolyn's husband didn't bother herself.,0.0
5151,Phillip says Amelia didn't embarrass himself.,Amelia says Phillip didn't embarrass himself.,1.0
5152,Guy didn't explain Veronica could remember himself.,Veronica didn't explain Guy could remember himself.,1.0
5153,George thinks Mary remembers herself.,Mary thinks George remembers herself.,0.0
5154,Brad should imagine Sarah might embarrass herself.,Sarah should imagine Brad might embarrass herself.,0.0
5155,Timothy imagines Ella does return to herself.,Ella imagines Timothy does return to herself.,0.0
5156,Frank explains Catherine might argue about herself.,Catherine explains Frank might argue about herself.,0.0
5157,Elizabeth would imagine Curtis hides himself.,Curtis would imagine Elizabeth hides himself.,0.0
5158,Craig won't explain Janice observes himself.,Janice won't explain Craig observes himself.,1.0
5159,Craig explains every woman wouldn't respect himself.,Every woman explains Craig wouldn't respect himself.,1.0
5160,Ruth explains Derek talks about herself.,Derek explains Ruth talks about herself.,1.0
5161,Angela's ex-wife imagines that guy doesn't listen to himself.,That guy imagines Angela's ex-wife doesn't listen to himself.,0.0
5162,Diana doesn't think Keith sounds like himself.,Keith doesn't think Diana sounds like himself.,0.0
5163,Melissa imagines Vincent could respect himself.,Vincent imagines Melissa could respect himself.,0.0
5164,Holly does say Alexander does visit himself.,Alexander does say Holly does visit himself.,0.0
5165,That actress didn't say Kathleen's ex-boyfriend cures himself.,Kathleen's ex-boyfriend didn't say that actress cures himself.,0.0
5166,Mitchell thinks Stacey couldn't astound himself.,Stacey thinks Mitchell couldn't astound himself.,1.0
5167,Benjamin says Melanie will attack herself.,Melanie says Benjamin will attack herself.,0.0
5168,That woman says Noah won't worry himself.,Noah says that woman won't worry himself.,0.0
5169,Katherine can't explain Omar fires herself.,Omar can't explain Katherine fires herself.,1.0
5170,Sara doesn't think Bradley dislikes himself.,Bradley doesn't think Sara dislikes himself.,0.0
5171,Guests' ex-girlfriend imagines Heidi's ex-husband didn't disagree with herself.,Heidi's ex-husband imagines guests' ex-girlfriend didn't disagree with herself.,1.0
5172,Melinda doesn't imagine Peter will fire himself.,Peter doesn't imagine Melinda will fire himself.,0.0
5173,Richard imagines some actress disturbs herself.,Some actress imagines Richard disturbs herself.,0.0
5174,Marcus should imagine Candice wouldn't flee from himself.,Candice should imagine Marcus wouldn't flee from himself.,1.0
5175,Derek might explain Sally leaves himself.,Sally might explain Derek leaves himself.,1.0
5176,Martha will think Eric can upset himself.,Eric will think Martha can upset himself.,0.0
5177,Kevin won't imagine Carla did find himself.,Carla won't imagine Kevin did find himself.,1.0
5178,Richard thinks Tara won't admire himself.,Tara thinks Richard won't admire himself.,1.0
5179,Todd can imagine Gina helps herself.,Gina can imagine Todd helps herself.,0.0
5180,Anna imagines Stephanie's grandfather hides herself.,Stephanie's grandfather imagines Anna hides herself.,1.0
5181,Adam says Elizabeth reveals herself.,Elizabeth says Adam reveals herself.,0.0
5182,Gary doesn't explain Tiffany will hug himself.,Tiffany doesn't explain Gary will hug himself.,1.0
5183,Marla would say James conceals herself.,James would say Marla conceals herself.,1.0
5184,Carlos can't think Cynthia watches himself.,Cynthia can't think Carlos watches himself.,1.0
5185,Florence says Alan escapes from himself.,Alan says Florence escapes from himself.,0.0
5186,Lori couldn't say Patrick's son shouldn't shock himself.,Patrick's son couldn't say Lori shouldn't shock himself.,0.0
5187,Meredith will say Aaron cares for himself.,Aaron will say Meredith cares for himself.,0.0
5188,Some girl says Brian boasts about herself.,Brian says some girl boasts about herself.,1.0
5189,Danielle can't imagine Paul dislikes himself.,Paul can't imagine Danielle dislikes himself.,0.0
5190,Frank thinks Anne conceals herself.,Anne thinks Frank conceals herself.,0.0
5191,Karen can say John sounds like herself.,John can say Karen sounds like herself.,1.0
5192,A woman might explain Mark won't approach himself.,Mark might explain a woman won't approach himself.,0.0
5193,Karla thinks Edward flees from himself.,Edward thinks Karla flees from himself.,0.0
5194,Daniel couldn't think Diana won't respect himself.,Diana couldn't think Daniel won't respect himself.,1.0
5195,Brett thinks Elizabeth couldn't stun himself.,Elizabeth thinks Brett couldn't stun himself.,1.0
5196,Dan should imagine Vanessa attacks himself.,Vanessa should imagine Dan attacks himself.,1.0
5197,Carmen thinks Phillip listens to himself.,Phillip thinks Carmen listens to himself.,0.0
5198,Angela could think Steven would discover herself.,Steven could think Angela would discover herself.,1.0
5199,This lady might imagine Alan observes herself.,Alan might imagine this lady observes herself.,1.0
5200,The associations that had not worried Cynthia have ever planned to shock every actress.,The associations that had worried Cynthia have not ever planned to shock every actress.,1.0
5201,Every son of Jerry who has not insulted Jerry can ever die.,Every son of Jerry who has insulted Jerry can not ever die.,1.0
5202,Most pedestrians' tutors that have not hired Alice can ever kiss.,Most pedestrians' tutors that have hired Alice can not ever kiss.,1.0
5203,The doctor that has referenced Diane might not ever move.,The doctor that has not referenced Diane might ever move.,0.0
5204,Some glasses that did not disturb Craig could ever flatten.,Some glasses that did disturb Craig could not ever flatten.,1.0
5205,Every skirt that has disgusted Beverly had not ever unfolded.,Every skirt that has not disgusted Beverly had ever unfolded.,0.0
5206,Every plane that was aggravating this waiter could not ever accelerate.,Every plane that was not aggravating this waiter could ever accelerate.,0.0
5207,Those turtles that are not boring April could ever break those couches.,Those turtles that are boring April could not ever break those couches.,1.0
5208,Every coat that did not scare Nina has ever wrinkled.,Every coat that did scare Nina has not ever wrinkled.,1.0
5209,A lot of men who should not hate Sharon can ever struggle.,A lot of men who should hate Sharon can not ever struggle.,1.0
5210,Renee's piano teachers that had not referenced Cindy could ever refuse to perform.,Renee's piano teachers that had referenced Cindy could not ever refuse to perform.,1.0
5211,Tonya's sons who were observing Stephanie can not ever talk about Carla.,Tonya's sons who were not observing Stephanie can ever talk about Carla.,0.0
5212,Many candles that might astound Naomi did not ever fade.,Many candles that might not astound Naomi did ever fade.,0.0
5213,Jeffrey's son that has not climbed down the mountain has ever argued.,Jeffrey's son that has climbed down the mountain has not ever argued.,1.0
5214,William's senators that should complain about Jodi might not ever stretch.,William's senators that should not complain about Jodi might ever stretch.,0.0
5215,These pedestrians that are not dropping by all glaciers had ever coughed.,These pedestrians that are dropping by all glaciers had not ever coughed.,1.0
5216,Tammy's bosses who have alarmed these people had not ever spun around.,Tammy's bosses who have not alarmed these people had ever spun around.,0.0
5217,That daughter of Sarah that was annoying Dana has not ever needed to walk through Harvard University.,That daughter of Sarah that was not annoying Dana has ever needed to walk through Harvard University.,0.0
5218,The brothers of Gary that had helped Ella could not ever declare every scarf to wrinkle.,The brothers of Gary that had not helped Ella could ever declare every scarf to wrinkle.,0.0
